<contacts xmlns:xsi="http://www.w3.org/2001/XMLSchema-instance"
    xsi:noNamespaceSchemaLocation="../contacts.xsd">

    <record>
        <name>
            <lastname>Rudincová</lastname>
            <firstname>Denisa</firstname>
            <middlename>Cecília</middlename>
        </name>

        <address>
            <street>Fialková</street>
            <house-number>42</house-number>
            <zipcode>424242</zipcode>
            <city>Lentilkovo</city>
            <country>Slovensko</country>
        </address>

        <phone>
            <type>personal</type>
            <value>+424242424242</value>
        </phone>

        <email>
            <type>academic</type>
            <value>524996@mail.muni.cz</value>
        </email>

        <email>
            <type>work</type>
            <value>xrudinc@fi.muni.cz</value>
        </email>
    
        <email>
            <type>personal</type>
            <value>denisa.rudinec@gmail.com</value>
        </email>

        <web>https://idkkflmln.sk</web>

        <personalized-contact>
            <service>Discord</service>
            <value>-</value>
        </personalized-contact>

        <note>Poznámka č. 1</note>
        <note>Poznámka č. 2</note>
        <note>Poznámka č. 3</note>
    </record>

</contacts>